id,url,title,description
351,"https://www.youtube.com/watch?v=ngM2N98ppQE","Introduction To Coq","Hands-on intro to Coq"
352,"https://github.com/afonsonf/tlaplus-graph-explorer","TLA+ Graph Explorer","Tool for viewing TLA+ state graphs"
353,"https://www.youtube.com/watch?v=YgXJf8c5PLo","Rebooting The LMARV-1 RISC-V Project","Formally verified RISC-V CPU"
354,"https://github.com/Hirrolot/datatype99","DataType99","Algebraic Data Types for C99"
355,"https://renderdoc.org/vulkan-in-30-minutes.html","Vulkan In 30 Minutes","Short overview of vulkan"
356,"https://chocopy.org/","Chocopy","An educational compiler to RISC-V for a subset of python"
357,"https://llvm.org/docs/tutorial/index.html","Kaleidoscope","Making a programming language with LLVM"
358,"http://hjemmesider.diku.dk/~torbenm/Basics/basics_lulu2.pdf","Basics Of Compiler Design","A lot of stuff that you would need to know if you want to make a compiler, includes register allocation and code generation"
359,"https://swtch.com/~rsc/regexp/regexp1.html","Regex Matching Can Be Simple And Fast","A very nice tutorial on how regex matching doesn't have to be complicated"
360,"https://ruslanspivak.com/lsbasi-part1/","Let's Build A Simple Interpreter","A very easy to follow on building an (incomplete) expression parser"
361,"https://compilers.iecc.com/crenshaw/","Let's Build A Compiler","Non-technical intro to compiler construction(the front-end part)"
362,"https://github.com/cksystemsteaching/selfie","Selfie","Educational repo consisting of a self-compiling C compiler, a self-executing RISC-V emulator and a RISC-V hypervisor"
363,"https://cyberzhg.github.io/toolbox/nfa2dfa","NFA To DFA Converter","Title says it all"
364,"https://www.youtube.com/watch?v=OsGnMm59wb4","Build Your Own Webassebly Compiler","Fantastic talk, nothing to add"
365,"https://jyp.github.io/pdf/Prettiest.pdf","A Pretty But Not Greedy Printer","Reasonably efficient pretty printer implementation"
366,"https://homepages.inf.ed.ac.uk/wadler/papers/prettier/prettier.pdf","A Pretty Printer","Functional description of a pretty printer"
367,"https://journal.stuffwithstuff.com/2015/09/08/the-hardest-program-ive-ever-written/","The Hardest Program I've Ever Written","Discussion on why pretty printers are difficult to implement"
368,"https://increment.com/programming-languages/crash-course-in-compilers/","A Crash Course On Compilers","A simple overview of what compilers are made of"
369,"https://blog.reverberate.org/2013/09/ll-and-lr-in-context-why-parsing-tools.html","Why Parsing Tools Are Hard","Discussion on parsing tools"
370,"https://github.com/DoctorWkt/acwj","A Compiler Writing Journey","Lots of lessons covering almost everything for writing a compiler"
371,"https://journal.stuffwithstuff.com/2011/03/19/pratt-parsers-expression-parsing-made-easy/","Pratt Parsers: Expression Parsing Made Easy","Explaining pratt parsers"
372,"https://www.craftinginterpreters.com/contents.html","Crafting Interpreters","Probably the best overall book on implementing an interpreter"
373,"https://keleshev.com/","Compiling To Assembly From Scratch","A book that covers every part of the compiler"
374,"https://blog.josephmorag.com/posts/mcc0/","Micro C","Writing a compiler for a small subset of C to LLVM in haskell"
375,"https://www.youtube.com/watch?v=b_T-eCToX1I","A New Architecture For Building Software","Improving compile times in LLVM"
376,"https://blog.scottlogic.com/2019/05/17/webassembly-compiler.html","Build Your Own WebAssebly Compiler","Learning more about webassembly and compilers"
377,"http://www.bayfronttechnologies.com/mc_tutorial.html","Metacompilers","Writing compilers inside web pages"
378,"https://arxiv.org/pdf/2005.06444.pdf","Pika Parsing","Reformulating packrat parsing as a dynamic programming algorithm solves the left recursion problem"
379,"https://drops.dagstuhl.de/opus/volltexte/2018/8453/","A Hitchhiker's Guide To Reinventing A Prolog Machine","Fresh look at implementing prolog"
380,"https://en.wikipedia.org/wiki/Warren_Abstract_Machine","Warren Abstract Machine","Abstract machine for executing prolog"
381,"https://news.ycombinator.com/item?id=23376357","C Internals","Seeing how C translates to assembly behind the scenes"
382,"https://tree-sitter.github.io/tree-sitter/","Tree-Sitter","Framework for incremental parsing, it would probably be cool to check it's source code"
383,"https://carolchen.me/blog/technical/jits-impls/","How JIT Compilers Are Implemented And Fast","Seeing how JITs work"
384,"https://github.com/MethodicalAcceleratorDesign/MADdocs/blob/master/luajit/luajit-doc.pdf","LuaJIT Doc","Describing how LuaJIT works"
385,"https://stffrdhrn.github.io/software/toolchain/openrisc/2020/07/21/relocs_tls_impl.html","How Relocations And Thread Local Store Are Implemented","How the compiler takes in account thread local store"
386,"https://eli.thegreenplace.net/2017/adventures-in-jit-compilation-part-1-an-interpreter/","Adventures In JIT Compilation","Building an interpreter for brainfuck"
387,"https://stackoverflow.com/questions/18188612/abstract-syntax-tree-representation-in-c/18189053","Abstract Syntax Tree Representation","Discussion on how an AST might be represented"
388,"http://dmitrysoshnikov.com/courses/parsing-algorithms/","Parsing Algorithms","Title says it all"
389,"http://dmitrysoshnikov.com/courses/essentials-of-interpretation/","Building An Interpreter From Scratch","Title says it all"
390,"https://arzg.github.io/lang/","Make A Programming Language In Rust","Front-end for a compiler, in rust"
391,"https://matklad.github.io/2020/04/13/simple-but-powerful-pratt-parsing.html","Simple But Powerful Pratt Parsing","Pratt parsing explained"
392,"https://www.stephendiehl.com/llvm/","Implementing A JIT Compiled Language With Haskell And LLVM","Title says it all"
393,"http://dev.stephendiehl.com/fun/","Write You A Haskell","Building A Modern Functional Compiler From First Principles"
394,"https://www.cs.cornell.edu/courses/cs6120/2020fa/self-guided/","Advanced Compilers","The Self Guided Online Course"
395,"https://news.ycombinator.com/item?id=25490826","Essentials Of Compilation","Compiling a subset of racket to x86-64 assembly"
396,"https://mukulrathi.co.uk/create-your-own-programming-language/llvm-ir-cpp-api-tutorial/","A Complete Guide To LLVM For Programming Language Creators","Title says it all"
397,"https://bernsteinbear.com/blog/inline-caching/","Inline Caching","Technique for runtime optimization"
398,"https://github.com/jserv/shecc","SheCC","Educational self hosting C compiler"
399,"https://iucompilercourse.github.io/IU-P423-P523-E313-E513-Fall-2020/","Course Webpage For Compilers","Translating Racket to x86 assembly"
400,"https://www.airs.com/blog/archives/38","Linkers","Series describing how to make a linker"
401,"https://www.youtube.com/watch?v=PXoG0WX0r_E","Implementing A Bignum Calculator","By Rob Pike"
402,"https://www.cl.cam.ac.uk/~pes20/rems/papers/oopsla-elf-linking-2016.pdf","The Missing Link","Explaining ELF Static Linking, Semantically"
403,"https://www.toolchains.net","Toolchains.net","Lots of resources for implementing linkers(and other stuff) or for contributing to clang(even GCC)"
404,"https://bernsteinbear.com/blog/lisp/","Compiling A Lisp","Tutorial on implementing a Lisp compiler"
405,"https://www.elsevier.com/books/engineering-a-compiler/cooper/978-0-12-088478-0","Engineering A Compiler","Alternative To The Dragon Book"
406,"https://www.jsoftware.com/papers/50/","A History Of APL In 50 Functions","Learning APL step by step"
407,"http://zenlang.sourceforge.net/","Zen","Programming language that compiles down to C++"
408,"https://www.unisonweb.org/","Unison Programming Language","A programming language where code is immutable"
409,"https://lowlevelbits.org/type-equality-in-llvm/","Type Equality In LLVM","Low level details of LLVM"
410,"https://en.wikipedia.org/wiki/Hindley%E2%80%93Milner_type_system","Hindley Milner Type System","Based on lambda calculus with parametric polymorphism"
411,"http://blog.llvm.org/2011/05/what-every-c-programmer-should-know.html","What Every C Programmer Should Know About Undefined Behavior","Title says it all"
412,"http://www.cs.ioc.ee/ewscs/2010/mycroft/linear-2up.pdf","Linear Types Can Change The World","Deep dive into linear types"
413,"https://codeguppy.com/site/download/draw_with_code_ro.pdf","Javascript For Kids","Learning JS with graphics"
414,"https://evilmartians.com/chronicles/hands-on-webassembly-try-the-basics","Hands-On WebAssembly","Learn webassembly step by step"
415,"http://dev.stephendiehl.com/hask/","What I Wish I Knew When Learning Haskell","Things to know about haskell"
416,"https://www.youtube.com/watch?v=rcjR3--M7iM","Brzozowski Derivatives","Converting from e-NFA to DFA directly"
417,"https://github.com/theacodes/Winterbloom_Castor_and_Pollux/blob/master/firmware/scripts/samd21g18a.ld","The Most Commented Linker Script In The World","Learning more about linker scripts"
418,"https://www.ic.unicamp.br/~meidanis/courses/mc336/2009s2/prolog/problemas/","99 Prolog Problems","Learning prolog through simple problems"
419,"https://www.metalevel.at/prolog","The Power Of Prolog","Learning Prolog"
420,"https://github.com/satwikkansal/wtfpython","WTF Python","Seeing lots of dark corners of Python"
421,"https://www.practical-go-lessons.com/","Practical Go Lessons","Includes a nice chapter on profiling"
422,"https://golang.org/doc/effective_go","Effective Go","Various concepts in Go explained"
423,"https://softwareengineering.stackexchange.com/questions/262377/what-are-the-practical-implications-of-homotopy-type-theory-in-programming","What Are The Practical Implications Of Homotopy Type Theory In Programming?","Title says it all"
424,"https://bartoszmilewski.com/2014/10/28/category-theory-for-programmers-the-preface/","Cateory Theory For Programmers","Book on category theory"
425,"https://arxiv.org/abs/1607.04822","HoTTSQL","Using Homotopy Type Theory to optimize SQL queries"
426,"https://python-poetry.org/","Poetry","Python tool for managing environments"
427,"https://astexplorer.net","AST Explorer","See the AST of various programming languages/markup languages"
428,"https://dhall-lang.org","Dhall Configuration Language","DRY config language"
429,"https://github.com/Feral-Lang/Feral","Feral Language","Minimal dynamically-typed language, seems to have a readable codebase"
430,"http://minikanren.org/","MiniKaren","DSL for logic programming"
431,"https://webassembly.studio/","WebAssembly Studio","Online IDE for webassembly"
432,"https://cpufun.substack.co64/p/atomics-in-aarch64","Atomics In AArch64","Dissecting the performance of a simple atomic operation on a couple of ARM AArch64 machines"
433,"https://turriate.com/articles/modern-javascript-everything-you-missed-over-10-years","Modern Javascript: Everything You Missed Over The Last 10 Years","Quick view of new features in JS"
434,"https://www.lightnote.co/","How Music Works","Learning Music Theory"
435,"https://www.susanjfowler.com/blog/2016/8/13/so-you-want-to-learn-physics","So You Want To Learn Physics...","Good resources for learning physics"
436,"https://thebuild.com/presentations/pgconfeu-2016-securing-postgresql.pdf","Securing PostgreSQL","Title says it all, might be applicable to any database"
437,"https://blog.knatten.org/2019/05/24/no-one-knows-the-type-of-char-char/","Noone Knows The Type Of `char + char`","C++ dark corner"
438,"https://gcc.gnu.org/wiki/Atomic/GCCMM/AtomicSync","Memory Model Synchronization Modes","Explaining memory order for atomics"
439,"https://howardhinnant.github.io/classdecl.html","How I Declare My Classes And Why","Tips on C++ good practice"
440,"https://www.drdobbs.com/cpp/volatile-the-multithreaded-programmers-b/184403766","Volatile: The Multithreaded Programmer's best friend","How volatile helps with multithreading"
441,"https://www.reddit.com/r/cpp/comments/f6wlbm/what_arewere_your_favourite_you_can_do_that_neat/","C++ 'You Can Do That!' Moments","Interesting discussion on C++"
442,"https://www.reddit.com/r/cpp/comments/5rbij8/c_quizzes/","C++ Quizzes","Title says it all"
443,"https://www.youtube.com/watch?v=OyNG4qiWnmU","The C++ Memory Model: An Intuition","Good, concise talk on the memory model of C++"
444,"https://devblogs.microsoft.com/cppblog/the-performance-benefits-of-final-classes/","The Performance Benefits Of Final Classes","Title says it all"
445,"https://eel.is/c++draft/","C++ Standard Draft","Up to date draft of the ISO C++ standard"
446,"https://stackoverflow.com/questions/14589346/is-c-context-free-or-context-sensitive/14589567#14589567","Is C++ Context-Free Or Context-Sensitive?","Interesting discussion on the syntax of C++"
447,"http://www.icce.rug.nl/documents/cplusplus/","C++ Annotations","Modern, up to date intro to C++"
448,"https://mpark.github.io/programming/2017/05/26/constexpr-function-parameters/","Constexpr Function Parameters","How to pass compile-time parameters to functions"
449,"https://github.com/GabrielDosReis/ipr","Compiler-Neutral Internal Program Representation For C++","Internal Program Representation for C++ programs"
450,"https://github.com/microsoft/STL/pull/724","Boyer Moore Searcher With Rytter Correction","Discussion on boyer moore searcher"
451,"http://www.open-std.org/jtc1/sc22/wg21/docs/papers/2019/p0957r2.pdf","A Generic, Extendable And Efficient Solution For Polymorphic Programming","An alternative to inheritance-style polymorphism"
452,"http://www.open-std.org/jtc1/sc22/wg21/docs/papers/2018/p0709r0.pdf","Deterministic Exceptions","(Better) Alternative to the current exception mechanism in C++"
453,"https://en.wikipedia.org/wiki/Barton%E2%80%93Nackman_trick","Barton-Nackman Trick","Relying On CRTP To DRY Yourself"
454,"https://en.cppreference.com/w/cpp/coroutine/noop_coroutine","`std::noop_coroutine`","How to implement a basic `task<T>`"
455,"https://en.cppreference.com/w/cpp/coroutine/coroutine_traits","`std::coroutine_traits`","How to implement basic continuation for `std::future`"
456,"https://en.cppreference.com/w/cpp/coroutine/coroutine_handle","`std::coroutine_handle`","How to implement a basic `generator<T>`"
457,"https://oleksandrkvl.github.io/2021/04/02/cpp-20-overview.html","All C++20 Core Lanugage Features With Examples","What every new feature in C++20 has to offer"