id,url,title,description
170,"https://www.puredevsoftware.com/blog/2019/01/22/sub-pixel-gamma-correct-font-rendering/","Sub-Pixel, Gamma Correct Font Rendering","Title says it all"
171,"https://richardjharris.github.io/unicode-in-five-minutes.html","Unicode In 5 Minutes","Quick Overview Of Unicode"
172,"https://begriffs.com/posts/2019-05-23-unicode-icu.html","Unicode Programming, With Examples","Some common operations done on unicode strings"
173,"https://github.com/libgdx/libgdx/wiki/Distance-field-fonts","Distance Field Fonts","Code examples that show how to implement effects using signed distance fields"
174,"https://cdn.cloudflare.steamstatic.com/apps/valve/2007/SIGGRAPH2007_AlphaTestedMagnification.pdf","Improved Alpha-Tested Magnification for Vector Textures and Special Effects","Original Valve paper on signed distance fields"
175,"https://damieng.com/blog/2007/06/13/font-rendering-philosophies-of-windows-and-mac-os-x","Font Rendering Philosophies Of Windows And MacOS X","Quick comparison of the renderers of these two platforms"
176,"https://material.io/design/typography/understanding-typography.html#type-properties","Understanding Typography","Typography design considerations"
177,"https://www.designsystems.com/color-guides/","Design Systems","Guides on correct color usage(and not only color, also general typography) for a beautiful design"
178,"https://tonsky.me/blog/emoji/","Emojis Under The Hood","How emojis are represented"
179,"https://research.nvidia.com/publication/infinite-resolution-textures","Infinite Resolution Textures","Some nice vector art algorithm"
180,"https://developer.nvidia.com/gpugems/gpugems3/part-iv-image-effects/chapter-25-rendering-vector-art-gpu","Rendering Vector Art On The GPU","The Loop-Blinn method"
181,"https://en.wikipedia.org/wiki/De_Casteljau%27s_algorithm","De Casteljau's Algorithm","An algorithm for dividing Bezier curves"
182,"http://developer.download.nvidia.com/devzone/devcenter/gamegraphics/files/opengl/gpupathrender.pdf","GPU-Accelerated Path Rendering","NVPR, Nvidia's driver support for hardware-accelerated vector graphics"
183,"http://kt8216.unixcab.org/murphy/index.html","Drawing Thick Lines","Using the Bresenham's algorithm"
184,"https://mattdesl.svbtle.com/drawing-lines-is-hard","Drawing Lines Is Hard","Showing how difficult it is to even draw a line correctly on the GPU, can be considered an overview of why 2D graphics are actually more difficult than 3D graphics"
185,"https://blog.mapbox.com/drawing-antialiased-lines-with-opengl-8766f34192dc","Drawing Anti-Aliased Lines In OpenGL","Drawing lines with anti-aliasing and miter joins in OpenGL"
186,"http://jcgt.org/published/0002/02/08/","Shader-Based Anti-Aliased, Dashed, Stroked Polylines","Drawing dashed lines on the GPU"
187,"https://nical.github.io/posts/a-look-at-pathfinder.html","A Look At Pathfinder","How does Pathfinder work?"
188,"https://raphlinus.github.io/rust/graphics/gpu/2019/05/08/modern-2d.html","2D Graphics On Modern GPU","An architecture for 2D graphics similar to RAVG and/or MPVG"
189,"http://hhoppe.com/ravg.pdf","Random-Access Rendering Of General Vector Graphics","RAVG, the successor to Loop-Blinn"
190,"http://w3.impa.br/~diego/projects/GanEtAl14/","Massively-Parallel Vector Graphics","MPVG, the successor to RAVG, uses a quadtree instead of a grid"
191,"http://www0.cs.ucl.ac.uk/staff/m.slater/Teaching/CG/1997-98/Solutions/Trap/","Trapezoidal Decomposition","Decomposing an arbitrarily complex polygon into trapezoids"
192,"https://nical.github.io/posts/lyon-intro.html","Introduction To Lyon: 2D Vector Graphics Rendering On The GPU","Describing the tesselator"
193,"https://raphlinus.github.io/graphics/curves/2019/12/23/flatten-quadbez.html","Flattening Quadratic Bezier Curves","Efficient converting of Bezier curves to polylines"
194,"https://ciechanow.ski/drawing-bezier-curves/","Drawing Bezier Curves","Subdividing Bezier curves, drawing them on iPhone"
195,"https://rubendv.be/posts/fwidth/","Drawing Anti-Aliased Circles In OpenGL","Using fwidth"
196,"https://backend.orbit.dtu.dk/ws/files/3735323/wire-sccg.pdf","Anti-Aliased Wireframe Rendering","Title says it all"
197,"https://github.com/servo/pathfinder/wiki/Related-approaches","Pathfinder Related Approaches","An overview of existing methods for rendering vector graphics"
198,"https://news.ycombinator.com/item?id=23512897","Fast 2D Rendering On GPU","An architecture for rendering 2D vector graphics on modern hardware, with some limitations"
199,"https://raphlinus.github.io/rust/graphics/gpu/2020/06/12/sort-middle.html","A Sort-Middle Architecture For 2D Graphics","Title says it all"
200,"https://blog.mecheye.net/2019/05/why-is-2d-graphics-is-harder-than-3d-graphics/","Why Are 2D Vector Graphics So Much Harder Than 3D?","Some history of vector graphics and how it has become so difficult to render efficiently"
201,"http://m1el.github.io/woscope-how/","How To Draw Oscilloscope Lines With Math And WebGL","Visualizing sound with WebGL"
202,"http://perfectionkills.com/exploring-canvas-drawing-techniques/","Canvas Drawing Techniques","A lot of brushes implemented, very useful if I ever want to make a painting app"
203,"https://www.youtube.com/watch?v=0ifChJ0nJfM","The Principles Of Drawing With Maths","Drawing using ray marching"
204,"http://tavmjong.free.fr/SVG/LINEJOIN_STUDY/","Line Joins Study","Different corner cases of line joins"
205,"https://www.youtube.com/watch?v=aNR4n0i2ZlM","Making A Heart With Maths","Ray marching"
206,"https://www.youtube.com/watch?v=JnCkF62gkOY","Painting A Flower With Maths In Google Sheets","Ray marching + Excel"
207,"https://www.youtube.com/watch?v=s5NGeUV2EyU","Rounding Corners In SDFs","Getting some cool effects for shapes by rounding corners"
208,"https://www.youtube.com/watch?v=PMltMdi1Wzg","Deriving The SDF Of A Line Segment","Getting some very cool shapes(like cilinders) just by modelling a line segment"
209,"https://pomax.github.io/bezierinfo/","A Primer On Bezier Curves","Everything Bezier curves"
210,"http://blog.hvidtfeldts.net/index.php/2015/01/path-tracing-3d-fractals/","Path Tracing 3D Fractals","Fractals in 3D"
211,"http://www.caffeineowl.com/graphics/2d/vectorial/cubic2quad01.html","Approximating Cubic Bezier Curves By Quadratic Ones","An efficient method for generating quadratic Bezier curves from cubic ones"
212,"http://w3.impa.br/~diego/teaching/vg/","2D Vector Graphics Course","From one of the authors of MPVG"
213,"http://kunzhou.net/zjugaps/pathrendering/","Efficient GPU Path Rendering Using Scanline Rasterization","Pretty complex(but fast) method for rendering vector graphics on the GPU"
214,"https://www.pokitec.com/research/FillingClosedBezierPaths.html","Filling Closed Bezier Paths","Easy to understand description of an algorithm for filling paths, unfortunately not numerically stable"
215,"http://web.engr.oregonstate.edu/~mjb/cs519/Projects/Papers/AcceleratingVectorGraphicsRendering.pdf","Accelerating Vector Graphics Rendering Using The Graphics Hardware Pipeline","How Illustrator makes use of the GPU"
216,"https://www.imedpub.com/articles/an-algorithm-for-computing-the-shortest-distance-between-a-point-and-quadratic-bezier-curve.php?aid=20779","An Algorithm For Computing The Shortest Distance Between A Point And A Quadratic Bezier Curve","Title says it all"
217,"http://alice.loria.fr/publications/papers/2005/VTM/vtm.pdf","Vector Texture Maps On The GPU","Rendering vector graphics using vector textures"
218,"https://citeseerx.ist.psu.edu/viewdoc/download?doi=10.1.1.218.5951&rep=rep1&type=pdf","Precise Vector Textures For Real-Time 3D Rendering","Rendering cubics directly, no approximations"
219,"https://stackoverflow.com/questions/60073813/is-it-possible-to-express-t-variable-from-cubic-bezier-curve-equation/60113617#60113617","Rendering Cubic Bezier Curves In GLSL","Might be useful as a reference"
220,"https://github.com/syaltamimi/image-to-vector","Image To Vector","Generating vector graphics from raster images"
221,"https://github.com/RazrFalcon/tiny-skia","Tiny-Skia","A subset of skia ported to rust, might learn from its source code"
222,"https://people.csail.mit.edu/tzumao/diffvg/","Differentiable Vector Graphics Rasterization For Editing And Learning","Being able to retrieve exactly the same path data just from the rasterized image"
223,"https://magcius.github.io/xplain/article/rast1.html","Basic 2D Rasterization","An easy to understand tutorial introducing vector graphics(anti-aliasing, alpha compositing, gradients and others)"
224,"https://github.com/Const-me/Vrmac#vector-graphics-engine","Vrmac Graphics Engine","Looks good at first sight, might be useful to check its source code"
225,"https://news.ycombinator.com/item?id=26448100","Fitting Cubic Bezier Curves","Algorithm for getting the closes curve to an existing one"
226,"https://raphlinus.github.io/curves/2021/02/19/parallel-curves.html","Cleaner Parallel Curves With Euler Spirals","Simple and efficient way to get parallel curves"
227,"https://renoth.medium.com/understanding-rust-as-a-c-developer-69ee8ca76fd6","Understanding Rust as a C++ Developer","Concise article on some of the similarities/differences between Rust and C++"
228,"https://www.reddit.com/r/learnprogramming/comments/214nd9/making_a_gui_from_scratch/","GUI From Scratch","Ideas for implementing GUI"
229,"http://citeseerx.ist.psu.edu/viewdoc/download?doi=10.1.1.88.9094&rep=rep1&type=pdf","Don't Fidget With Widgets, Draw!","A very intuitive interface for a GUI, old but relevant"
230,"https://github.com/sixtyfpsui/sixtyfps","SixtyFPS","UI framework similar to Qt(created by ex-Qt employees I think), much less feature rich but has an intuitive interface"
231,"https://github.com/p-ranav/indicators","Activity Indicators","Seems to have a readable codebase, might steal something from here when implementing activity bars in a GUI"
232,"https://github.com/ttauri-project/ttauri","TTauri","A lot of stuff implemented from scratch here, might be useful as a reference"
233,"https://github.com/NXPmicro/gtec-demo-framework/blob/master/Doc/FslSimpleUI.md","Design Considerations For A Modern UI","Definitely worth checking out when implementing a GUI"
234,"https://raytracing.github.io/","Ray Tracing In One Weekend, The Next Week, Rest Of Your Life","Books on ray tracing, easy to follow, includes BVHs and other things"
235,"https://www.codeplay.com/portal/blogs/2020/05/19/ray-tracing-in-a-weekend-with-sycl-basic-sphere-tracing.html","Ray Tracing In A Weekend With SYCL","Ray Tracing In One Weekend but this time with SYCL"
236,"https://github.com/StanEpp/OpenGL_Raytracing","Path Tracing In Compute Shaders Using OpenGL","Easy to understand, might be useful as a reference"
237,"https://blog.scottlogic.com/2020/03/10/raytracer-how-to.html","Write A Raytracer Intuitively","Very easy to follow tutorial on ray tracing"
238,"https://en.wikipedia.org/wiki/M%C3%B6ller%E2%80%93Trumbore_intersection_algorithm","Moller-Trumbore Intersection Algorithm","Algorithm for detecting ray intersections with triangles"
239,"https://bheisler.github.io/post/writing-gpu-accelerated-path-tracer-part-1/","Writing A GPU-Accelerated Path Tracer In Rust","Path tracing on the GPU"
240,"http://raytracey.blogspot.com/2016/11/opencl-path-tracing-tutorial-1-firing.html","OpenCL Path Tracing Tutorial","Path tracing on the GPU using OpenCL"
241,"http://raytracey.blogspot.com/2015/10/gpu-path-tracing-tutorial-1-drawing.html","GPU Path Tracing","Using CUDA"
242,"https://www.kevinbeason.com/smallpt/","Smallpt","Path tracing in 99 lines of C++"
243,"https://github.com/vkoskiv/c-ray","C-Ray","Easy to understand source for a path tracer, might be useful as a reference"
244,"https://www.shadertoy.com/view/4lfGWr","Bidirectional Path Tracer","Real time in shadertoy"
245,"https://github.com/CppCon/CppCon2019/tree/master/Presentations/path_tracing_three_ways_a_study_of_cpp_styles","Path Tracing 3 Ways","Using FP, OOP and DOD to make a path tracer in C++"
246,"https://casual-effects.com/research/McGuire2019ProcGen/McGuire2019ProcGen.pdf","Ray Tracing A Tiny Procedural Planet","Drawing a plant using ray tracing"
247,"https://pragprog.com/titles/jbtracer/the-ray-tracer-challenge/","The Ray Tracer Challenge","Easy to understand book on ray tracing, includes some stuff on constructive solid geometry"
248,"https://github.com/ekzhang/rpt","RPT","Physically based path tracer in rust"
249,"https://people.cs.kuleuven.be/~philip.dutre/GI/","Global Illumination Compendium","All maths behind ray tracing"
250,"https://github.com/knightcrawler25/GLSL-PathTracer","GLSL Path Tracer","Path tracer entirely in a fragment shader, has some nice scene tests"
251,"https://www.shadertoy.com/view/3tsyzl","Julia Quaternion","Ray marching a fractal in shadertoy"
252,"https://www.shadertoy.com/view/4ttSWf","Rain Forest","Ray marching terrain in shadertoy"
253,"http://jamie-wong.com/2016/07/15/ray-marching-signed-distance-functions/","Ray Marching Signed Distance Functions","Title says it all"
254,"https://www.youtube.com/watch?v=eED4bSkYCB8","Building Collision Simulations: An Introduction To Computer Graphics","Includes a nice explanation of BVH"
255,"https://en.wikipedia.org/wiki/Bounding_interval_hierarchy","Bounding Interval Hierarchy","A slight improvement of BVHs"
256,"https://computergraphics.stackexchange.com/questions/4979/what-is-importance-sampling","What Is Importance Sampling?","Explained"
257,"https://agraphicsguy.wordpress.com/2015/11/01/sampling-microfacet-brdf/","Sampling Microfacet BRDF","Some sampling theory"
258,"https://agraphicsguynotes.com/posts/monte_carlo_integral_with_multiple_importance_sampling/","Monte Carlo Integration With Multiple Importance Sampling","An explanation of importance sampling"
259,"https://www.gamedev.net/blogs/entry/2261086-importance-sampling/","Importance Sampling","Deep dive into importance sampling"
260,"https://dopedesi.com/2021/03/08/its-raymarching-march/","Ray Marching ASCII Graphics","Generating ASCII art"
261,"https://github.com/xelatihy/yocto-gl","Yocto/GL","Data-Oriented physically based rendering, might be useful as a reference"
262,"https://github.com/CatalaLang/catala","Catala","Programming language for the law"
263,"https://vulkan-tutorial.com/","Vulkan Tutorial","Shows a lot of stuff about vulkan in an easy to understand way"
264,"https://github.com/KhronosGroup/Vulkan-ValidationLayers/blob/master/docs/debug_printf.md","`debug_printf`","Debugging helper for Vulkan"
265,"https://developer.nvidia.com/blog/introduction-turing-mesh-shaders/","Mesh Shaders","A different kind of shader"
266,"https://zeux.io/2020/02/27/writing-an-efficient-vulkan-renderer/","Writing An Efficient Vulkan Renderer","Design considerations for a Vulkan renderer"
267,"https://www.khronos.org/anari","ANARI","Analytic Rendering Interface for Data Visualization"
268,"https://vkguide.dev/","Vulkan Guide","An easy to understand tutorial on Vulkan"
269,"https://vincent-p.github.io/notes/20201216234910-the_projection_matrix_in_vulkan/","The Projection Matrix In Vulkan","Title says it all"
270,"https://arrayfire.com/","ArrayFire","GPGPU cross-platform library"
271,"https://cachemiss.xyz/blog/parallel-reduce-and-scan-on-the-GPU","Parallel Reduce And Scan On The GPU","Title says it all"
272,"https://raphlinus.github.io/gpu/2020/04/30/prefix-sum.html","Prefix Sum On Vulkan","Title says it all"
273,"https://towardsdatascience.com/parallelizing-heavy-gpu-workloads-via-multi-queue-operations-50a38b15a1dc","Parallelizing GPU-Intensive Workloads Via Multi-Queue Operations Using Vulkan Kompute","Do more stuff in parallel with a multi-queue operation"
274,"https://github.com/michaelerule/webgpgpu","WebGPGPU","Bits of image processing in WebGL"
275,"https://gafferongames.com/post/fix_your_timestep/","Fix Your Timestep","Designing a main loop for a game correctly"
276,"https://www.youtube.com/watch?v=aKLntZcp27M","Using Rust For GameDev","General advice for using Rust for gamedev"
277,"https://github.com/eduard-permyakov/permafrost-engine","Permafrost Game Engine","RTS game engine, might be useful as a reference"
278,"https://www.cgal.org/","CGAL","Computational geometry library"
279,"https://www.geometrictools.com/Documentation/TriangulationByEarClipping.pdf","Triangulation By Ear Clipping","Ear clipping explained"
280,"https://flipcode.com/archives/Efficient_Polygon_Triangulation.shtml","Efficient Polygon Triangulation","Code example of polygon triangulation"
281,"http://citeseerx.ist.psu.edu/viewdoc/download?doi=10.1.1.49.3013&rep=rep1&type=pdf","FITS: Fast Industrial-Strength Triangulation Of Polygons","Ear clipping algorithm"
282,"https://en.wikipedia.org/wiki/Delaunay_triangulation","Delaunay Triangulation","A more efficient triangulation algorithm"
283,"http://commaexcess.com/articles/7/concave-polygon-triangulation-shortcut","Triangulation Using The Stencil Buffer","Quick hack"
284,"https://www.springer.com/gp/book/9783540779735","Computational Geometry: Algorithms And Applications","Book on computational geometry"
285,"https://www.researchgate.net/publication/325488464_Fast_Fluid_Simulations_with_Sparse_Volumes_on_the_GPU","Fast Fluid Simulations With Sparse Volumes On The GPU","Method for rendering fluids on the GPU"
286,"https://developer.download.nvidia.com/books/HTML/gpugems/gpugems_ch38.html","Fast Fluid Dynamics Simulation On The GPU","Fluid simulation on the GPU"
287,"https://github.com/PavelDoGreat/WebGL-Fluid-Simulation","WebGL Fluid SImulation","Might be useful as a reference"
288,"https://www.3dgep.com/understanding-quaternions/","Understanding Quaternions","Quaternions for the layman"
289,"https://marctenbosch.com/quaternions/","Let's Remove Quaternions From Every 3D Game Engine","Better understanding quaternions"
290,"https://blog.winter.dev/2020/designing-a-physics-engine/","Designing A Physiscs Engine","Physics engine design considerations"
291,"https://github.com/polymonster/maths","Maths Library For C++","Useful for games, has a readable codebase, supports swizzling"
292,"https://www.youtube.com/watch?v=JjQxst7kVsU","Simple Mesh Math For Complex Geometry Operations","Fun with matrix multiplications"
293,"https://security.stackexchange.com/questions/211/how-to-securely-hash-passwords","How To Securely Hash Passwords","Discussion on storing passwords"
294,"https://felleisen.org/matthias/7480-s21/index.html","History Of Programming Languages","_Lots_ of resources for studying how various paradigms in PL have evolved"
295,"https://doc.rust-lang.org/nomicon/","Rustonomicon","All the awful details that you need to understand when writing unsafe Rust"
296,"https://en.wikipedia.org/wiki/Storseisundet_Bridge","Storseisundet Bridge","Norway"
297,"https://lwn.net/Kernel/LDD3/","Linux Device Drivers","Writing drivers for Linux"
298,"https://blog.cloudflare.com/http3-the-past-present-and-future/","HTTP/3: The Past, The Present, And The Future","Discussion on what advantages QUIC has over TCP"
299,"https://ro.wikipedia.org/wiki/Cobor,_Bra%C8%99ov","Satul Cobor","Brașov"
300,"https://ro.wikipedia.org/wiki/Cabana_Diham","Cabana Diham","Munții Bucegi"
301,"https://ro.wikipedia.org/wiki/M%C4%83gura,_Bra%C8%99ov","Măgura, Brașov","Mica Elveție, sat situat la poalele munților Bucegi și Piatra Craiului"
302,"https://github.com/microsoft/Web-Dev-For-Beginners","Web Dev For Beginners","Learn by practising, includes quizzes"
303,"https://ro.wikipedia.org/wiki/Inele%C8%9B,_Cara%C8%99-Severin","Ineleț, Caraș-Severin","Foarte izolat, se poate ajunge acolo doar pe o scară de lemn, sau un drum de 4 ore aproape de Băile Herculane"
304,"https://www.facebook.com/St%C3%A2na-din-Grind-la-Gicu-lu-Pipu%C8%9B%C4%83-Piatra-Craiului-1656371127908300/","Stâna din Grind","Munții Piatra Craiului"
305,"https://mikro.naprvyraz.sk/docs/index.htm","Graphics Resources","A huge collection of resource for computer graphics, kind of similar to mathpages"
306,"https://rayground.com/","Rayground","Ray tracing prototyping on the web"
307,"https://refractiveindex.info","Refractiveindex","All the refractive indexes you need"
308,"https://www.geometrictools.com/Documentation/RotationRepresentations.pdf","Rotation Issues","Discussion on different rotation methods"
309,"https://github.com/lettier/3d-game-shaders-for-beginners","3D Game Shaders For Beginners","SSAO, depth of field, lighting, normal mapping and others"
310,"http://igorsklyar.com/system/documents/papers/4/fiscourse.comp.pdf","Importance Sampling For Production Rendering","Explaining (multiple) importance sampling and all the statistics behind it"
311,"https://www.youtube.com/watch?v=E8CBgyFv2xc","Intuitive Idiot-Proof Validation Of Importance Sampling For Monte Carlo Computations","Explaining importance sampling"
312,"https://www.fasterthan.life/blog/2017/7/11/i-am-graphics-and-so-can-you-part-1","I Am Graphics And So Can You","Diving into graphics programming (and Vulkan) for non-experts"
313,"https://www.mark-boer.nl/posts/higher-level-threading","Higher Level Threading In C++","Multithreading primitives explained"
314,"https://www.lpalmieri.com/posts/error-handling-rust/?utm_campaign=Book&utm_source=Reddit&utm_medium=Social","Error Handling In Rust: A Deep Dive","Practical error handling in rust with examples"
315,"http://www.vishalchovatiya.com/cpp20-coroutine-under-the-hood/","C++20 Coroutines: Under The Hood","Thoroughly understanding coroutines in C++"
316,"https://www.forth.com/starting-forth/","Starting FORTH","The classic Forth tutorial"
317,"http://thinking-forth.sourceforge.net/","Thinking Forth","Another Forth classic"
318,"https://learnyousomeerlang.com/content","Learn You Some Erlang For Great Good","Intuitive tutorial on Erlang"
319,"https://github.com/X-Neon/kuro","Kuro","Practical usage of coroutines with examples"
320,"https://www.nytimes.com/interactive/2020/health/pfizer-biontech-covid-19-vaccine.html","How The Pfizer BioNTech Vaccine Works","A more detailed view over the vaccine"
321,"https://pastebin.com/raw/jGkg0SAq","Debug Symbol","HUGE debug symbol, welcome to C++"
322,"https://www.lynalden.com/inflation/","The Ultimate Guide To Inflation","Title says it all"
323,"http://jtfmumm.com/blog/2015/11/17/crdt-primer-1-defanging-order-theory/","A CRDT Primer Part I: Defanging Order Theory","Series of articles presenting CRDTs"
324,"https://ro.wikipedia.org/wiki/V%C3%A2rful_Leaota,_Mun%C8%9Bii_Leaota","Leaota","Vârf pe care se poate ajunge cu mașina"
325,"https://www.feynmanlectures.caltech.edu/","The Feynman Lectures On Physics","Proper way to learn physics"
326,"https://blog.compiler.ai/2021/05/06/verification-is-tcbpb-reduction/","Verification = TCB/PB Reduction","What does it mean to formally verify something?"
327,"https://themaister.net/blog/2017/08/15/render-graphs-and-vulkan-a-deep-dive/","Render Graphs And Vulkan, A Deep Dive","Title Says It All"
328,"https://www.gamasutra.com/blogs/EgorYusov/20181211/332596/Taking_State_Transitions_in_Vulkan_and_Direct3D12_under_Control_a_Diligent_Approach.php","Taking State Transitions In Vulkan And Direct3D12 Under Control: A Dilligent Approach","State management and synchronization"
329,"https://arxiv.org/abs/2007.00308","Polar Stroking: New Theory And Methods For Stroking Paths","Render stroked paths robustly, intuitively"
330,"http://w3.impa.br/~diego/projects/Neh20/","Converting Stroked Primitives To Filled Primitives","From one of the authors of MPVG"
331,"https://lamport.azurewebsites.net/tla/high-level-view.html","A High-Level View Of TLA+","Learning TLA+ from Leslie Lamport Himself"
332,"http://docs.idris-lang.org/en/latest/tutorial/","Idris Tutorial","Learning Idris"
333,"https://www.ccs.neu.edu/home/stchang/pubs/cbtb-popl2020.pdf","Dependent Types As Macros","Implementing dependent types using just macros"
334,"https://github.com/veka41/neut","Neut","Programming language without GC, with dependent types"
335,"https://probablydance.com/2020/10/31/using-tla-in-the-real-world-to-understand-a-glibc-bug/","Using TLA+ In The Real World To Understand A Glibc Bug","Practical TLA+"
336,"https://softwarefoundations.cis.upenn.edu/","Software Foundations","Mathematical underpinnings of reliable software"
337,"https://fstar-lang.org/tutorial/tutorial.html","Verified Programming In F*","A nice intro to formal verification"
338,"https://arxiv.org/abs/1808.09701","Comparison Of Two Theorem Provers: Isabelle/HOL And Coq","Includes an overview of logic"
339,"http://math.andrej.com/2007/09/28/seemingly-impossible-functional-programs/","Seemingly Impossible Functional Programs","Some intersections between maths and FP"
340,"https://arxiv.org/abs/1703.08683","Applied Type System: An Approach To Practical Programming With Theorem Proving","Practical tutorial for ATS"
341,"http://www.cs.toronto.edu/~hehner/FMSD/","Formal Methods Of Software Design","Using maths to write error-free programs"
342,"https://www.lri.fr/~paulin/LASER/course-notes.pdf","Introduction To The Coq Proof Assistant For Practical Software Verification","Practical tutorial on Coq"
343,"http://adam.chlipala.net/cpdt/","Certified Programming With Dependent Types","Tutorial on formal verification"
344,"http://www.ieee-security.org/TC/SPW2014/papers/5103a198.PDF","The Pitfalls Of Protocol Design","Attempting to write a formally verified PDF parser"
345,"https://www.isa-afp.org/","Archive Of Formal Proofs","Huge list of formal proofs"
346,"https://github.com/math-comp/fourcolor","Formal Proof Of The 4-color Theorem","Using coq"
347,"https://hardmath123.github.io/meet-the-robinson.html","Meet The Robinson: An Introduction To Automatic Theorem Proving","Title says it all"
348,"https://www.hillelwayne.com/post/action-properties/","TLA+ Action Properties","A deeper dive into TLA+"
349,"https://pron.github.io/posts/tlaplus_part1","TLA+ In Practice And Theory","Learning formal methods with TLA+"
350,"https://cs.uwaterloo.ca/~plragde/flaneries/LACI/","Logic And Computation Intertwined","Proofs and their applications in computer science"
